{
  "$schema": "./producto.schema.json",
  "schemaVersion": 1,
  "contractVersion": "1.0.0",
  "updatedOn": "2026-10-19",
  "product": {
    "id": "smartkea-learning-campus",
    "title": "SmartKEA · Aprender informática, sistemas y terminal",
    "defaultLanguage": "es",
    "owner": "SmartKEA",
    "purpose": "Aprendizaje guiado, práctica con evidencia y autoevaluación inmediata a partir del contenido real del repositorio.",
    "deliveryType": "design_and_implementation_handoff",
    "currentArchitecture": "Python build + static HTML/CSS/JavaScript; browser-local learning records",
    "productionApiRequired": false,
    "studentAccountsRequired": false
  },
  "provenance": {
    "repository": "https://github.com/smartkea-cyberinnovation/fundamentos-ciberseguridad",
    "canonicalBranch": "main",
    "snapshotCommit": null,
    "snapshotVersion": "3.1.0",
    "productionVerification": "Not performed by this documentation package; verify final main SHA after Workers deployment.",
    "sourcesFile": "FUENTES.md",
    "manifestFile": "manifest.json",
    "publicBaselineCommit": "769c1ba947f5f092894a258974116e82a77a02f1",
    "consolidationReviewStatus": "Reviewed local integration; remote publication and production acceptance are separate.",
    "snapshotScope": "Maintained template. exportar.py fills build/head/public-ref only in the exported copy; exact source hashes are in manifest.json.",
    "sourceHead": null,
    "publicSourceRef": null
  },
  "make": {
    "masterPromptFile": "FIGMA-MAKE.md",
    "masterPrompt": "# SmartKEA · Instrucciones completas para Figma Make\n\n**Versión del encargo: 1.0.0 · Revisada el 19 de octubre de 2026.** Esta especificación sirve para diseñar, montar una versión revisable e integrar mejoras en el producto existente. El repositorio canónico es [smartkea-cyberinnovation/fundamentos-ciberseguridad](https://github.com/smartkea-cyberinnovation/fundamentos-ciberseguridad). Los contratos y el banco se adjuntan en JSON. El manifiesto identifica el snapshot utilizado; este documento no declara una publicación nueva ni sustituye la aceptación del despliegue.\n\n## Prompt de trabajo\n\nActúa como un equipo de diseño de producto educativo, frontend y revisión de calidad. Mejora SmartKEA para que un estudiante pueda entender qué estudiar, avanzar con guía concreta, practicar en su entorno y ensayar preguntas con corrección inmediata. Trabaja sobre el producto y los datos existentes. Conserva los identificadores, las rutas canónicas, las respuestas correctas, las explicaciones y la continuidad de los registros locales.\n\nEl resultado debe ser un campus profesional, claro y funcional en escritorio, tableta y móvil. Prioriza lectura, práctica y siguiente acción. Entrega pantallas con estados completos y comportamiento comprobable, un registro de cambios y una ruta de integración en Git. Utiliza esta especificación y `producto.json` como contrato de producto; `catalogo-publico.json` inventaría las unidades reales; `muestras-contenido.json` aporta contenido largo real; `banco-preguntas.json` contiene las cien preguntas completas. Si un archivo del repositorio no está disponible en el entorno Make, indícalo por su ruta y conserva su interfaz; no inventes contenido, respuestas, servicios ni resultados de pruebas.\n\n### Orden de autoridad\n\n1. La petición del propietario del producto y las correcciones aceptadas durante el trabajo.\n2. Contenido, contratos y comportamiento verificados del repositorio para el snapshot identificado.\n3. Esta especificación y `producto.json` para las mejoras propuestas.\n4. Preferencias genéricas del generador, únicamente donde no exista una decisión anterior.\n\nUna propuesta de interfaz no cambia por sí sola el currículo ni la evaluación. Si un cambio exige modificar el significado de un identificador, una clave de progreso, una ruta o el esquema de un banco, presenta primero la migración concreta y sus casos de prueba dentro de la revisión de código.\n\n## 1. Qué existe y qué se propone\n\n| Superficie | Producto real que se conserva | Mejora de experiencia propuesta |\n|---|---|---|\n| Campus general | 32 módulos, 96 fichas de laboratorio, 46 recursos, siete bloques y 480 horas planificadas; ES/EN; biblioteca, búsqueda, presentación y continuidad local | Mejorar la orientación inicial, el acceso a lo último estudiado y la siguiente acción contextual |\n| Aula de sistemas | 28 lecciones ES/EN: cuatro comunes, ocho Linux, ocho Windows y ocho macOS; 500 vistas; comprobaciones, guía de entorno, foco/pausa y registro opcional | Hacer más visible la relación entre objetivo, concepto, micropráctica, evidencia y recuperación |\n| Examen de informática | Banco público de 100 preguntas en español; 20 aleatorias por intento; cuatro opciones; corrección inmediata; explicación; resumen y repaso | Perfeccionar la jerarquía de progreso, el tratamiento de estados y el enlace al estudio posterior |\n| TERM | 16 módulos, 48 lecciones, 48 retos y 96 preguntas en español; aprender, practicar, resolver y comprobar; laboratorio opcional | Clarificar el paso actual, el contexto del comando y la diferencia entre ejemplo y resultado realmente observado |\n| Rutas por perfil | Seis rutas profesionales y 26 etapas con objetivos, evidencias, fuentes y prerrequisitos; integración local revisada | Facilitar la elección de perfil y la siguiente etapa sin mezclar horas ni progreso |\n| Asistencia | Guías, pistas, cuestionarios y orientación local, sin servicio de IA generativa | Añadir orientación por reglas sobre el contenido existente, explicando por qué sugiere cada siguiente paso |\n\nLas cifras proceden de los catálogos generados, no de texto promocional. Las 480 horas no son asistencia, tiempo realmente estudiado ni carga oficial de una asignatura distinta. Los recorridos se solapan: no sumar sus horas ni convertir sus porcentajes en un único índice de competencia. D37–D40 conservan resumen en inglés y edición docente completa EN pendiente. D41–D46 sí tienen lecturas desarrolladas ES/EN en el snapshot. El examen y TERM siguen en español. [R-CATALOG] [R-OS] [R-EXAM] [R-TERM]\n\n### Seis rutas profesionales de la integración revisada\n\nLa integración local ya incorpora `formacion/rutas/routes.json`, su validador `campus/learning_paths.py` y la página `rutas.html`. Se trata de una capacidad **existente en la integración revisada**; su publicación se confirma aparte con el SHA servido. El inventario generado incluye las seis rutas completas, sus 26 etapas, trece programas externos y 32 fuentes públicas. [R-PATHS] [R-PATHS-BUILD] [R-PATHS-TEST]\n\n| ID | Perfil real | Etapas | Dedicación orientativa |\n|---|---|---:|---|\n| `no-tecnico` | No técnico · negocio y personas | 4 | 8 semanas · 32 h |\n| `legal` | Jurídico · privacidad y contratación | 4 | 12 semanas · 72 h |\n| `dpd` | DPD · gobierno de privacidad | 6 | 16 semanas · 128 h |\n| `tecnico` | Técnico · soporte y operación | 4 | 14 semanas · 84 h |\n| `informatico` | Informático · desarrollo y arquitectura | 4 | 14 semanas · 112 h |\n| `ciber` | Ciberseguridad · defensa, GRC y auditoría | 4 | 14 semanas · 112 h |\n\nEstimaciones de dedicación al itinerario por actividades seleccionadas. No se suman a las 480 h del curso ni equivalen a completar los módulos enlazados o a formación reconocida. Los módulos completos conservan horas y prerrequisitos propios.\n\nConserva entrada, objetivo, trabajo y evidencia de cada etapa, consulta de prerrequisitos, fuentes oficiales, filtro por perfil, modo presentación e impresión. Un enlace a certificación o programa externo conduce a sus condiciones oficiales; no acredita que el alumno lo haya obtenido ni que SmartKEA expida esa credencial. Las marcas de evidencia son opcionales, usan `smartkea.learning-paths.v1`, no incluyen notas o identidad personal y no alteran el progreso del campus. Su identidad técnica `recordId` distingue vidas del registro para coordinar pestañas; no representa a un alumno. [R-PATHS-UI] [R-PATHS-BROWSER]\n\n### Ampliación existente: caso C99-DFIR\n\nLos módulos M27, M28 y M29 enlazan la práctica **C99-DFIR · Una shell con una llamada oculta** del repositorio. Conserva sus diez actividades, guía de alumno ES/EN, escenario sintético, herramientas offline, informe, soluciones y rúbrica. Sus doce preguntas públicas pertenecen al caso y no al banco de cien del examen. Es una ampliación de los módulos existentes: no añade horas, módulos, nuevas marcas ni una ruta de servidor propia. La actividad usa evidencias inertes y, opcionalmente, una shell legítima en un contenedor local; no presenta la muestra sospechosa como software que el campus ejecute. Enlaza las fuentes y los entregables reales, sin inventar un incidente ni una máquina conectada. [R-FORENSIC-CASE] [R-FORENSIC-PRACTICE] [R-FORENSIC-QUESTIONS] [R-FORENSIC-INTEGRATION]\n\n## 2. Usuarios y resultados de aprendizaje\n\nEl estudiante principiante necesita comprender vocabulario, relaciones y límites antes de ejecutar órdenes. Su éxito es explicar una idea con sus palabras, predecir un efecto y comprobarlo en un entorno adecuado. El estudiante con experiencia necesita localizar una laguna y practicarla sin recorrer de nuevo material que ya comprende. El docente necesita lecturas, retos, criterios y evidencia legible; la versión actual no recibe notas ni datos personales de alumnos.\n\nDiseña tres entradas visibles usando contenidos existentes: **Comprender informática**, **Practicar sistemas** y **Dominar la terminal**. El examen es un acceso de ensayo, con una invitación a estudiar después de los fallos. Usa los mismos términos en navegación, encabezados y acciones. Una etiqueta como «Comprobado por ti» es más precisa que «Dominado» cuando no hay verificación externa.\n\nNo bloquees el aprendizaje por crear una cuenta. No fuerces un diagnóstico previo ni un temporizador. El alumno puede leer sin guardar progreso, cambiar de recorrido, volver atrás o ensayar de nuevo.\n\n## 3. Recorrido guiado del estudiante\n\n### A.